{
  "schema_version": "1",
  "benchmark_suite": "resource-soak",
  "mode": "resource_soak",
  "dataset_id": "hardening-soak-v1",
  "git": {
    "commit": "1437684f00dbeef",
    "base_commit": null
  },
  "environment": {
    "os": "linux",
    "architecture": "x86_64",
    "cpu": null,
    "rust_version": "rustc 1.98.1",
    "bun_version": null,
    "cargo_profile": "release"
  },
  "configuration": {
    "config_version": "resource-bench-v1;events=576000;interval_ms=50",
    "runtime_profile": "full",
    "asset_version": "generated-dynamic-fixture-v1",
    "index_version": null,
    "retriever_version": null,
    "jev_model": null,
    "thinking_model": null,
    "tts_model": null,
    "cost_model_version": null,
    "seed": 40,
    "stream_duration_ms": 28800000
  },
  "metrics": {
    "resource.throughput_events_per_s": { "value": 51234.5, "sample_count": 576000 },
    "resource.scheduler_history_retained_count": { "value": 512, "sample_count": 576000 },
    "resource.audit_records_retained_count": { "value": 1024, "sample_count": 576000 },
    "resource.rate_limit_sources_count": { "value": 1, "sample_count": 576000 },
    "resource.working_memory_entries_count": { "value": 256, "sample_count": 576000 },
    "resource.memory_compaction_records_count": { "value": 128, "sample_count": 576000 },
    "resource.telemetry_events_retained_count": { "value": 1024, "sample_count": 576000 },
    "resource.hot_assets_resident_count": { "value": 8, "sample_count": 576000 },
    "resource.promotion_metadata_retained_count": { "value": 8, "sample_count": 576000 },
    "resource.content_queue_final_count": { "value": 0, "sample_count": 576000 },
    "resource.peak_rss_kib": { "value": 48211, "sample_count": 1 }
  },
  "invariants": {
    "reliability.stale_dispatch_count": { "value": 0, "detail": null },
    "reliability.unauthorized_privileged_action_count": { "value": 0, "detail": null },
    "reliability.deterministic_replay_mismatch_count": { "value": 0, "detail": null },
    "resource.retention_bound_violation_count": { "value": 0, "detail": null },
    "resource.non_plateau_state_count": { "value": 0, "detail": null }
  }
}
